<?xml version="1.0" encoding="UTF-8"?>
<source_function_p_prime xmlns:xsi="http://www.w3.org/2001/XMLSchema-instance" xsi:noNamespaceSchemaLocation="../../../settings_schema/xsd/equilibrium/source_function_p_prime.xsd">
    <method>efit_polynomial</method>
    <efit_polynomial>
        <n_dof>2</n_dof>
        <regularisations>
            <row>0.0 0.00004467344</row>
        </regularisations>
        <exact>false</exact>
    </efit_polynomial>
    <tensioned_cubic_b_spline>
        <regularisations>
            <row>1.50700e-03 -2.25900e-03  7.51998e-04  0.00000e+00  0.00000e+00  0.00000e+00  0.00000e+00  0.00000e+00  0.00000e+00  0.00000e+00 0.00000e+00</row>
            <row>0.00000e+00  3.75999e-04 -6.26832e-04  2.50833e-04  0.00000e+00  0.00000e+00  0.00000e+00  0.00000e+00  0.00000e+00  0.00000e+00 0.00000e+00</row>
            <row>0.00000e+00  0.00000e+00  2.50833e-04 -5.01666e-04  2.50833e-04  0.00000e+00  0.00000e+00  0.00000e+00  0.00000e+00  0.00000e+00 0.00000e+00</row>
            <row>0.00000e+00  0.00000e+00  0.00000e+00  2.50833e-04 -5.51632e-04  3.00799e-04  0.00000e+00  0.00000e+00  0.00000e+00  0.00000e+00 0.00000e+00</row>
            <row>0.00000e+00  0.00000e+00  0.00000e+00  0.00000e+00  4.00732e-04 -9.74064e-04  5.73332e-04  0.00000e+00  0.00000e+00  0.00000e+00 0.00000e+00</row>
            <row>0.00000e+00  0.00000e+00  0.00000e+00  0.00000e+00  0.00000e+00  1.14452e-03 -3.36859e-03  2.22407e-03  0.00000e+00  0.00000e+00 0.00000e+00</row>
            <row>0.00000e+00  0.00000e+00  0.00000e+00  0.00000e+00  0.00000e+00  0.00000e+00  4.16818e-03 -1.16697e-02  7.50147e-03  0.00000e+00 0.00000e+00</row>
            <row>0.00000e+00  0.00000e+00  0.00000e+00  0.00000e+00  0.00000e+00  0.00000e+00  0.00000e+00  1.20012e-02 -3.60029e-02  2.40017e-02 0.00000e+00</row>
            <row>0.00000e+00  0.00000e+00  0.00000e+00  0.00000e+00  0.00000e+00  0.00000e+00  0.00000e+00  0.00000e+00  6.00028e-02 -2.10010e-01 1.50007e-01</row>
            <row>0.00000e+00  0.00000e+00  0.00000e+00  0.00000e+00  0.00000e+00  0.00000e+00  0.00000e+00  0.00000e+00  0.00000e+00  0.00000e+00 1.00000e+10</row>
        </regularisations>
        <interior_knots>0.20 0.40 0.60 0.80 0.90 0.95 0.98</interior_knots>
        <interval_tensions>1e+00 1e+00 1e+00 1e+00 1e+00 1e+00 1e+00 1e+00</interval_tensions>
        <make_cubic_spline_regularisations>true</make_cubic_spline_regularisations>
        <regularisation_builder>
            <regularisation_scale>1e-6</regularisation_scale>
            <regularisation_mode>second_derivative_zero</regularisation_mode>
            <left_boundary_condition>free</left_boundary_condition>
            <left_boundary_weight>1e10</left_boundary_weight>
            <right_boundary_condition>free</right_boundary_condition>
            <right_boundary_weight>1e10</right_boundary_weight>
        </regularisation_builder>
    </tensioned_cubic_b_spline>
</source_function_p_prime>
